{"agent_infrastructure_assessment":"No material agent-infrastructure issue identified. The only project instruction is the read-only/test directive in `AGENTS.md:1-5`; no project-scoped skills, agents, plugins, or MCP configuration were present in the 13 tracked files inspected.","architecture_status":"No material architecture drift identified. `src/todo.py:1-16` has a minimal local JSON path boundary using `Path` and atomic sibling replacement, with no network or external-service dependency.","derived_doc_status":"No material derived-document drift identified. `docs/EDD.md:3-6` remains the hub, `docs/architecture/storage.md:3-5` contains the detailed extraction, `docs/structural-change-log.md:3-4` records it, and the link target existence check returned `True`.","edd_status":"Compliant in reviewed scope. `docs/EDD.md:3-6` and `docs/architecture/storage.md:3-5` require caller-supplied local JSON storage, atomic sibling replacement, and no network service; `src/todo.py:10-16` implements that behavior.","executive_summary":"Full read-only audit completed across the repository structure, AGENTS.md, PRD, EDD, milestone, structural-change log, architecture detail, README, manifest, source, and tests. No substantive evidence-backed semantic issues were found. Runtime test execution was unavailable because neither `python` nor an installed `py` interpreter was present; static test inspection was completed.","findings":[],"milestone_status":"Compliant in reviewed scope based on static evidence. `docs/milestones/m1.md:3` requires offline add/list, restart persistence, and a reopen test; `src/todo.py:5-16` provides load/add persistence and `tests/test_todo.py:7-11` exercises add followed by a fresh load from the file.","prd_status":"Compliant in reviewed scope. `docs/PRD.md:3` requires offline add/list and persistence in a user-selected local file; `src/todo.py:5-16` uses the caller-supplied path without a network dependency and persists the complete task array.","recommended_next_actions":["Install or expose the repository's supported Python runtime and rerun `python -m unittest discover -s tests`; no repository change is recommended from the reviewed evidence."],"test_confidence":"Moderate static confidence, limited runtime confidence. `tests/test_todo.py:7-11` contains a meaningful persistence assertion, but `python -m unittest discover -s tests` failed because `python` was unavailable and `py -m unittest discover -s tests` reported `No installed Python found!`."}