{"executive_summary":"Full read-only semantic audit completed at revision f36f053809a764faefb42296ced9f7641cae1f7e. PRD, EDD, M1, implementation, and inspected test agree that bookmarks persist in local SQLite; the README materially contradicts that behavior. One Medium derived-documentation finding was identified. No Critical or High findings were found, and the worktree remained unchanged.","findings":[{"title":"README reverses the repository's core persistence guarantee","severity":"Medium","category":"Derived Documentation Drift","evidence":["README.md:3 states that bookmarks exist only in process memory and are permanently discarded when the program closes.","docs/PRD.md:3 and docs/milestones/m1.md:3 require bookmarks to persist locally and reload after restart.","docs/EDD.md:3-4 defines SQLite at the configured path as authoritative and requires each added URL to be committed before return.","src/store.py:4-27 (`BookmarkStore.__init__`, `add`, and `all`) creates a file-backed SQLite table, commits inserts, and reloads stored URLs through new connections.","tests/test_store.py:7-11 (`StoreTests.test_reopens_persisted_bookmark`) asserts that a new `BookmarkStore` instance using the same database path reads the previously added bookmark."],"expected_behavior":"As a derived user-facing document, README.md should accurately summarize the persistent local-storage behavior established by the PRD, EDD, milestone, and implementation.","actual_behavior":"README.md describes the exact opposite behavior, claiming storage is process-local and all bookmarks are lost at shutdown.","why_it_matters":"Users and maintainers are misled about the product's defining data-lifecycle guarantee and may incorrectly treat stored bookmarks as ephemeral or conclude that M1 is unimplemented.","recommended_action":"Replace README.md:3 with a concise statement that bookmarks are stored in SQLite at the configured local path and persist across restarts; keep implementation and authoritative design documents unchanged.","confidence":"High"}],"prd_status":"Compliant in reviewed scope. The file-backed SQLite implementation in src/store.py:4-27 persists bookmarks as required by docs/PRD.md:3.","edd_status":"Compliant in reviewed scope. `BookmarkStore` creates the SQLite schema, uses the configured path, commits additions before returning, and reads from that authoritative store as specified by docs/EDD.md:3-4.","milestone_status":"Compliant in reviewed scope. M1's local persistence and reload requirement at docs/milestones/m1.md:3 is implemented and covered by an inspected reopen test.","test_confidence":"Moderate from inspection but not execution. tests/test_store.py:7-11 meaningfully checks persistence across store reconstruction using the same file. `python -m unittest discover -s tests` could not run because `python` was unavailable, and `py -m unittest discover -s tests` reported that no Python installation was present.","architecture_status":"No architecture drift detected. The implementation directly follows the EDD's local SQLite authority and introduces no additional runtime services or dependencies.","derived_doc_status":"Drift confirmed: README.md:3 contradicts the authoritative documents, implementation, and test regarding persistence. No other derived documentation was present.","agent_infrastructure_assessment":"Appropriate and minimal. AGENTS.md:1-5 supplies fixture-specific read-only and verification instructions; no additional project-scoped skills, MCP configuration, plugins, hooks, or custom agents were present.","recommended_next_actions":["Correct README.md:3 to describe persistent local SQLite storage.","When Python 3.10 or newer is available, run `python -m unittest discover -s tests` to obtain execution evidence for the inspected persistence test."]}